A3: √⁄œ«œ «·ÿ·«» «·„ﬁÌœÊ‰ ›Ï «·⁄«„ «·Ã«„⁄Ï 2009/2008†
B4: „” Ãœ | F4: „‰ﬁÊ· | J4: »«ﬁÏ ··≈⁄«œ… | N4: «·«Ã„«·Ï | R4: «·Ã„·…
B5: „’—Ï | D5: Ê«›œ | F5: „’—Ï | H5: Ê«›œ | J5: „’—Ï | L5: Ê«›œ | N5: „’—Ï | P5: Ê«›œ
B6: – | C6: √ | D6: – | E6: √ | F6: – | G6: √ | H6: – | I6: √ | J6: – | K6: √ | L6: – | M6: √ | N6: – | O6: √ | P6: – | Q6: √
A7: «‰ Ÿ«„ | B7: 3780 | C7: 5527 | D7: 0 | E7: 7 | F7: 14223 | G7: 18686 | H7: 15 | I7: 2 | J7: 2444 | K7: 1027 | L7: 7 | M7: 0 | N7: 20447 | O7: 25240 | P7: 22 | Q7: 9 | R7: 45718
A8: «‰ ”«» | B8: 82 | C8: 19 | D8: 0 | E8: 0 | F8: 191 | G8: 41 | H8: 0 | I8: 0 | J8: 147 | K8: 44 | L8: 0 | M8: 0 | N8: 420 | O8: 104 | P8: 0 | Q8: 0 | R8: 524
A9: «‰ ”«» „ÊÃÂ | B9: 1885 | C9: 1654 | D9: 0 | E9: 0 | F9: 4004 | G9: 3287 | H9: 2 | I9: 0 | J9: 1706 | K9: 851 | L9: 3 | M9: 0 | N9: 7595 | O9: 5792 | P9: 5 | Q9: 0 | R9: 13392
A10: «·«Ã„«·Ï | B10: 5747 | C10: 7200 | D10: 0 | E10: 7 | F10: 18418 | G10: 22014 | H10: 17 | I10: 2 | J10: 4297 | K10: 1922 | L10: 10 | M10: 0 | N10: 28462 | O10: 31136 | P10: 27 | Q10: 9 | R10: 59634
AB12: „” Ãœ | AD12: „‰ﬁÊ· | AF12: »«ﬁÏ ··«⁄«œ…
W13: =AB14+AD14+AF14 -> 28489 | X13: =AC14+AE14+AG14 -> 31145 | Y13: =SUM(W13:X13) -> 59634 | AB13: – | AC13: √ | AD13: – | AE13: √ | AF13: – | AG13: √
V14: =SUM(N10+P10) -> 28489 | W14: =SUM(O10+Q10) -> 31145 | X14: =SUM(V14:W14) -> 59634 | AB14: =B10+D10 -> 5747 | AC14: =C10+E10 -> 7207 | AD14: =F10+H10 -> 18435 | AE14: =G10+I10 -> 22016 | AF14: =J10+L10 -> 4307 | AG14: =K10+M10 -> 1922
W15: ⁄œœ «·ÿ·«»
V16: «‰ Ÿ«„ | W16: 50675
V17: «‰ ”«» | W17: 428 | AC17: =SUM(J10+L10) -> 4307 | AD17: =SUM(K10+M10) -> 1922
V18: «‰ ”«» „ÊÃÂ | W18: 14763
A20: √⁄œ«œ «·ÿ·«» «·„ﬁÌœÊ‰ ›Ï «·⁄«„ «·Ã«„⁄Ï 2009/2008†
B21: „” Ãœ | F21: „‰ﬁÊ· | J21: »«ﬁÏ ··≈⁄«œ… | N21: «·«Ã„«·Ï | R21: «·Ã„·…
B22: „’—Ï | D22: Ê«›œ | F22: „’—Ï | H22: Ê«›œ | J22: „’—Ï | L22: Ê«›œ | N22: „’—Ï | P22: Ê«›œ
B23: – | C23: √ | D23: – | E23: √ | F23: – | G23: √ | H23: – | I23: √ | J23: – | K23: √ | L23: – | M23: √ | N23: – | O23: √ | P23: – | Q23: √ | X23: „’—Ï | Z23: Ê«›œ
A24: «‰ Ÿ«„ | B24: 1370 | C24: 1024 | D24: 0 | E24: 0 | F24: 3668 | G24: 2876 | H24: 2 | I24: 1 | J24: 630 | K24: 178 | L24: 1 | M24: 0 | N24: 5668 | O24: 4078 | P24: 3 | Q24: 1 | R24: 9750 | X24: – | Y24: √ | Z24: – | AA24: √
A25: «‰ ”«» | B25: 26 | C25: 1 | D25: 0 | E25: 0 | F25: 37 | G25: 1 | H25: 0 | I25: 0 | J25: 18 | K25: 0 | L25: 0 | M25: 0 | N25: 81 | O25: 2 | P25: 0 | Q25: 0 | R25: 83 | W25: «‰ Ÿ«„ | X25: 29195 | Y25: 31940 | Z25: 15 | AA25: 3
A26: «‰ ”«» „ÊÃÂ | B26: 604 | C26: 259 | D26: 1 | E26: 0 | F26: 1038 | G26: 418 | H26: 0 | I26: 1 | J26: 638 | K26: 177 | L26: 0 | M26: 0 | N26: 2280 | O26: 854 | P26: 1 | Q26: 1 | R26: 3136 | W26: «‰ ”«» | X26: 377 | Y26: 115 | Z26: 0 | AA26: 0
A27: «·«Ã„«·Ï | B27: 2000 | C27: 1284 | D27: 1 | E27: 0 | F27: 4743 | G27: 3295 | H27: 2 | I27: 2 | J27: 1286 | K27: 355 | L27: 1 | M27: 0 | N27: 8029 | O27: 4934 | P27: 4 | Q27: 2 | R27: 12969 | W27: «‰ ”«» „ÊÃÂ | X27: 11663 | Y27: 6781 | Z27: 8 | AA27: 2
X28: =SUM(X25:X27) -> 41235 | Y28: =SUM(Y25:Y27) -> 38836 | Z28: =SUM(Z25:Z27) -> 23 | AA28: =SUM(AA25:AA27) -> 5 | AB28: =SUM(X28:AA28) -> 80099
Z31: „” Ãœ | AB31: „‰ﬁÊ· | AD31: »«ﬁÏ ··«⁄«œ…
Z32: – | AA32: √ | AB32: – | AC32: √ | AD32: – | AE32: √
Z33: =B27+D27 -> 2001 | AA33: =C27+E27 -> 1284 | AB33: =F27+H27 -> 4745 | AC33: =G27+I27 -> 3297 | AD33: =J27+L27 -> 1287 | AE33: =K27+M27 -> 355